{
  "$schema": "https://json-schema.org/draft/2020-12/schema",
  "$id": "https://saberistic.com/schemas/world-manifest-v0.json",
  "title": "World Manifest v0",
  "description": "Canonical World Manifest v0 schema for WorldGraph (issue #199). Spike validation also uses spike/worldgraph/manifest_schema.py for runtime provenance rules.",
  "type": "object",
  "required": ["schema_version", "identity", "experience", "ai_role", "trust"],
  "additionalProperties": false,
  "properties": {
    "schema_version": {
      "type": "string",
      "const": "world-manifest-v0"
    },
    "identity": {
      "type": "object",
      "required": ["name", "canonical_url", "world_type", "status"],
      "additionalProperties": false,
      "properties": {
        "world_id": { "$ref": "#/$defs/provenStringOrUnknown" },
        "name": { "$ref": "#/$defs/provenString" },
        "canonical_url": { "$ref": "#/$defs/provenUrl" },
        "summary": { "$ref": "#/$defs/provenStringOrUnknown" },
        "status": { "$ref": "#/$defs/provenString" },
        "version": { "$ref": "#/$defs/provenStringOrUnknown" },
        "created_at": { "$ref": "#/$defs/provenStringOrUnknown" },
        "updated_at": { "$ref": "#/$defs/provenStringOrUnknown" },
        "world_type": { "$ref": "#/$defs/provenString" },
        "modalities": {
          "type": "array",
          "items": { "$ref": "#/$defs/provenString" }
        },
        "creator": { "$ref": "#/$defs/provenStringOrUnknown" },
        "operator": { "$ref": "#/$defs/provenStringOrUnknown" },
        "claimed_owner": { "$ref": "#/$defs/provenStringOrUnknown" }
      }
    },
    "experience": {
      "type": "object",
      "required": ["entry_points", "interaction_model", "persistence_model"],
      "additionalProperties": false,
      "properties": {
        "entry_points": {
          "type": "array",
          "minItems": 1,
          "items": { "$ref": "#/$defs/provenUrl" }
        },
        "supported_devices": {
          "type": "array",
          "items": { "$ref": "#/$defs/provenString" }
        },
        "interaction_model": { "$ref": "#/$defs/provenString" },
        "persistence_model": { "$ref": "#/$defs/provenStringOrUnknown" },
        "access_requirements": { "$ref": "#/$defs/provenStringOrUnknown" },
        "pricing": { "$ref": "#/$defs/provenStringOrUnknown" },
        "availability": { "$ref": "#/$defs/provenStringOrUnknown" },
        "region": { "$ref": "#/$defs/provenStringOrUnknown" },
        "age_guidance": { "$ref": "#/$defs/provenStringOrUnknown" },
        "supported_languages": {
          "type": "array",
          "items": { "$ref": "#/$defs/provenString" }
        }
      }
    },
    "world_structure": {
      "type": "object",
      "additionalProperties": false,
      "properties": {
        "setting": { "$ref": "#/$defs/provenStringOrUnknown" },
        "lore_or_canon": { "$ref": "#/$defs/provenStringOrUnknown" },
        "rules_or_mechanics": { "$ref": "#/$defs/provenStringOrUnknown" },
        "state_model": { "$ref": "#/$defs/provenStringOrUnknown" },
        "agents_and_characters": {
          "type": "array",
          "items": { "$ref": "#/$defs/linkedEntityRef" }
        },
        "assets_and_dependencies": {
          "type": "array",
          "items": { "$ref": "#/$defs/linkedEntityRef" }
        },
        "platforms": {
          "type": "array",
          "items": { "$ref": "#/$defs/linkedEntityRef" }
        },
        "engines_models_protocols": {
          "type": "array",
          "items": { "$ref": "#/$defs/linkedEntityRef" }
        },
        "economy": { "$ref": "#/$defs/provenStringOrUnknown" },
        "governance": { "$ref": "#/$defs/provenStringOrUnknown" }
      }
    },
    "ai_role": {
      "type": "object",
      "required": ["material_ai_role", "ai_usage_phase"],
      "additionalProperties": false,
      "properties": {
        "material_ai_role": { "$ref": "#/$defs/provenString" },
        "ai_usage_phase": { "$ref": "#/$defs/provenString" },
        "generated_or_agent_controlled": { "$ref": "#/$defs/provenStringOrUnknown" },
        "model_disclosures": {
          "type": "array",
          "items": { "$ref": "#/$defs/provenStringOrUnknown" }
        },
        "human_control_boundaries": { "$ref": "#/$defs/provenStringOrUnknown" }
      }
    },
    "trust": {
      "type": "object",
      "required": ["qualification_status", "claim_status"],
      "additionalProperties": false,
      "properties": {
        "qualification_status": {
          "type": "string",
          "enum": ["qualifies", "excluded", "pending_review"]
        },
        "exclusion_reason": {
          "type": "string",
          "enum": [
            "static_ai_media_only",
            "single_purpose_assistant",
            "foundation_model_or_tool_not_world",
            "platform_product_not_world",
            "no_stable_entry_point",
            "marketing_only_no_experience"
          ]
        },
        "claim_status": {
          "type": "string",
          "enum": [
            "unclaimed",
            "creator_claimed",
            "domain_verified",
            "github_verified",
            "email_domain_verified",
            "saberistic_verified"
          ]
        },
        "license_status": { "$ref": "#/$defs/provenStringOrUnknown" },
        "commercial_use_status": { "$ref": "#/$defs/provenStringOrUnknown" },
        "ip_declarations": {
          "type": "array",
          "items": { "$ref": "#/$defs/provenStringOrUnknown" }
        },
        "source_evidence": {
          "type": "array",
          "items": { "$ref": "#/$defs/provenUrl" }
        },
        "safety_categories": {
          "type": "array",
          "items": { "$ref": "#/$defs/provenStringOrUnknown" }
        },
        "moderation_contact": { "$ref": "#/$defs/provenStringOrUnknown" },
        "data_privacy_notes": { "$ref": "#/$defs/provenStringOrUnknown" },
        "content_rights_notes": { "$ref": "#/$defs/provenStringOrUnknown" }
      },
      "allOf": [
        {
          "if": {
            "properties": { "qualification_status": { "const": "excluded" } },
            "required": ["qualification_status"]
          },
          "then": { "required": ["exclusion_reason"] }
        }
      ]
    },
    "discovery": {
      "type": "object",
      "additionalProperties": false,
      "properties": {
        "tags": {
          "type": "array",
          "items": { "$ref": "#/$defs/provenString" }
        },
        "facets": {
          "type": "object",
          "additionalProperties": { "$ref": "#/$defs/provenStringOrUnknown" }
        },
        "semantic_description": { "$ref": "#/$defs/provenStringOrUnknown" },
        "representative_media": {
          "type": "array",
          "items": { "$ref": "#/$defs/provenUrl" }
        },
        "related_worlds": {
          "type": "array",
          "items": { "$ref": "#/$defs/linkedEntityRef" }
        },
        "inspirations": {
          "type": "array",
          "items": { "$ref": "#/$defs/linkedEntityRef" }
        },
        "forks_imports_dependencies": {
          "type": "array",
          "items": { "$ref": "#/$defs/linkedEntityRef" }
        },
        "primary_call_to_action": { "$ref": "#/$defs/provenStringOrUnknown" }
      }
    },
    "extensions": {
      "type": "object",
      "description": "Forward-compatible vendor-specific fields.",
      "additionalProperties": true
    }
  },
  "$defs": {
    "provenance": {
      "type": "object",
      "required": ["source_kind", "confidence", "observed_at"],
      "additionalProperties": false,
      "properties": {
        "source_kind": {
          "type": "string",
          "enum": [
            "source_observation",
            "creator_declared",
            "derived",
            "unknown"
          ]
        },
        "source_url": { "type": ["string", "null"], "format": "uri" },
        "evidence_snippet": { "type": ["string", "null"], "maxLength": 2000 },
        "confidence": { "type": "number", "minimum": 0, "maximum": 1 },
        "observed_at": { "type": "string", "format": "date-time" },
        "verification_status": {
          "type": "string",
          "enum": [
            "unverified",
            "domain_verified",
            "github_verified",
            "email_domain_verified",
            "saberistic_verified"
          ]
        }
      }
    },
    "provenString": {
      "type": "object",
      "required": ["value", "provenance"],
      "additionalProperties": false,
      "properties": {
        "value": {
          "type": "string",
          "minLength": 1,
          "not": { "const": "unknown" }
        },
        "provenance": { "$ref": "#/$defs/provenance" }
      }
    },
    "provenUrl": {
      "type": "object",
      "required": ["value", "provenance"],
      "additionalProperties": false,
      "properties": {
        "value": { "type": "string", "format": "uri" },
        "provenance": { "$ref": "#/$defs/provenance" }
      }
    },
    "unknownProvenance": {
      "type": "object",
      "required": ["source_kind", "confidence", "observed_at"],
      "additionalProperties": false,
      "properties": {
        "source_kind": { "const": "unknown" },
        "source_url": { "type": "null" },
        "evidence_snippet": { "type": "null" },
        "confidence": { "const": 0 },
        "observed_at": { "type": "string", "format": "date-time" },
        "verification_status": {
          "type": "string",
          "enum": ["unverified"]
        }
      }
    },
    "provenStringOrUnknown": {
      "oneOf": [
        {
          "type": "object",
          "required": ["value", "provenance"],
          "additionalProperties": false,
          "properties": {
            "value": { "const": "unknown" },
            "provenance": { "$ref": "#/$defs/unknownProvenance" }
          }
        },
        { "$ref": "#/$defs/provenString" }
      ]
    },
    "linkedEntityRef": {
      "type": "object",
      "required": ["entity_type", "entity_id"],
      "additionalProperties": false,
      "properties": {
        "entity_type": {
          "type": "string",
          "enum": [
            "world",
            "platform",
            "agent",
            "character",
            "creator",
            "organization",
            "asset",
            "ip"
          ]
        },
        "entity_id": { "type": "string", "minLength": 1 },
        "display_name": { "$ref": "#/$defs/provenStringOrUnknown" },
        "reference_url": { "$ref": "#/$defs/provenUrl" },
        "external_standard": {
          "type": "string",
          "enum": [
            "a2a_agent_card",
            "mcp_registry",
            "c2pa_manifest",
            "gltf",
            "usd",
            "webxr",
            "other"
          ]
        }
      }
    }
  }
}
