{
  "schema_version": "world-manifest-v0",
  "identity": {
    "name": {
      "value": "Helpful Assistant",
      "provenance": {
        "source_kind": "source_observation",
        "source_url": "https://example.com/worldgraph-spike/negative/assistant",
        "evidence_snippet": "Helpful Assistant chatbot",
        "confidence": 0.82,
        "observed_at": "2026-07-22T00:00:00+00:00",
        "verification_status": "unverified"
      }
    },
    "canonical_url": {
      "value": "https://example.com/worldgraph-spike/negative/assistant",
      "provenance": {
        "source_kind": "source_observation",
        "source_url": "https://example.com/worldgraph-spike/negative/assistant",
        "evidence_snippet": "assistant chat URL",
        "confidence": 0.9,
        "observed_at": "2026-07-22T00:00:00+00:00",
        "verification_status": "unverified"
      }
    },
    "world_type": {
      "value": "assistant",
      "provenance": {
        "source_kind": "derived",
        "source_url": "https://example.com/worldgraph-spike/negative/assistant",
        "evidence_snippet": "single-purpose assistant",
        "confidence": 0.75,
        "observed_at": "2026-07-22T00:00:00+00:00",
        "verification_status": "unverified"
      }
    },
    "status": {
      "value": "published",
      "provenance": {
        "source_kind": "derived",
        "source_url": "https://example.com/worldgraph-spike/negative/assistant",
        "evidence_snippet": "published",
        "confidence": 0.5,
        "observed_at": "2026-07-22T00:00:00+00:00",
        "verification_status": "unverified"
      }
    }
  },
  "experience": {
    "entry_points": [
      {
        "value": "https://example.com/worldgraph-spike/negative/assistant/chat",
        "provenance": {
          "source_kind": "source_observation",
          "source_url": "https://example.com/worldgraph-spike/negative/assistant",
          "evidence_snippet": "chat entry",
          "confidence": 0.8,
          "observed_at": "2026-07-22T00:00:00+00:00",
          "verification_status": "unverified"
        }
      }
    ],
    "interaction_model": {
      "value": "single_turn_chat",
      "provenance": {
        "source_kind": "source_observation",
        "source_url": "https://example.com/worldgraph-spike/negative/assistant",
        "evidence_snippet": "Q&A chat without world state",
        "confidence": 0.7,
        "observed_at": "2026-07-22T00:00:00+00:00",
        "verification_status": "unverified"
      }
    },
    "persistence_model": {
      "value": "unknown",
      "provenance": {
        "source_kind": "unknown",
        "source_url": null,
        "evidence_snippet": null,
        "confidence": 0,
        "observed_at": "2026-07-22T00:00:00+00:00",
        "verification_status": "unverified"
      }
    }
  },
  "ai_role": {
    "material_ai_role": {
      "value": "General-purpose Q&A assistant with no bounded world context",
      "provenance": {
        "source_kind": "source_observation",
        "source_url": "https://example.com/worldgraph-spike/negative/assistant",
        "evidence_snippet": "no world lore or rules",
        "confidence": 0.72,
        "observed_at": "2026-07-22T00:00:00+00:00",
        "verification_status": "unverified"
      }
    },
    "ai_usage_phase": {
      "value": "runtime",
      "provenance": {
        "source_kind": "derived",
        "source_url": "https://example.com/worldgraph-spike/negative/assistant",
        "evidence_snippet": "runtime",
        "confidence": 0.5,
        "observed_at": "2026-07-22T00:00:00+00:00",
        "verification_status": "unverified"
      }
    }
  },
  "trust": {
    "qualification_status": "excluded",
    "exclusion_reason": "single_purpose_assistant",
    "claim_status": "unclaimed"
  }
}
